{"coverage":{"consecutive_pairs":328,"excluded_missing_l1":7,"intervals":81,"note":"excluded_missing_l1 counts pairs dropped because one side of the book was empty. Reported rather than silently skipped: a coverage number that is not printed reads as full coverage.","price_changing_pairs":5,"windows":4},"estimator_definitions":"docs/contract/cont_analysis_io.md","harness_id":"cont-type-lob-harness","harness_version":"0.1.0","outputs":{"depth_impact":{"lambda":null,"log_c":null,"n":2,"note":"not estimable: fewer than 3 usable windows, or zero variation in log depth","standard_error":null},"ofi_regression_by_window":[{"diagnostic_all":{"alpha":-0.077794562,"alpha_standard_error":0.05171495,"beta":0.074018127,"ddof":2,"n":20,"r_squared":0.278991401,"specification":"with intercept (primary)","standard_error":0.028046369,"uncertainty":"standard errors of the slope and intercept; ddof = 2; n as stated"},"diagnostic_all_no_intercept":{"beta":0.080882353,"ddof":1,"n":20,"r_squared":0.296568627,"specification":"no intercept (secondary, proportionality diagnostic)","standard_error":0.028577566,"uncertainty":"standard error of the slope; ddof = 1; n as stated"},"mean_depth":4.3325,"n_intervals":20,"primary_non_price_changing":{"alpha":-0.100638978,"alpha_standard_error":0.059946934,"beta":0.012779553,"ddof":2,"n":20,"r_squared":0.005898255,"specification":"with intercept (primary)","standard_error":0.039105068,"uncertainty":"standard errors of the slope and intercept; ddof = 2; n as stated"},"secondary_non_price_changing_no_intercept":{"beta":0.010638298,"ddof":1,"n":20,"r_squared":0.003546099,"specification":"no intercept (secondary, proportionality diagnostic)","standard_error":0.040911792,"uncertainty":"standard error of the slope; ddof = 1; n as stated"},"window_index":0},{"diagnostic_all":{"alpha":0.0,"alpha_standard_error":0.0,"beta":0.0,"ddof":2,"n":20,"r_squared":null,"specification":"with intercept (primary)","standard_error":0.0,"uncertainty":"standard errors of the slope and intercept; ddof = 2; n as stated"},"diagnostic_all_no_intercept":{"beta":0.0,"ddof":1,"n":20,"r_squared":null,"specification":"no intercept (secondary, proportionality diagnostic)","standard_error":0.0,"uncertainty":"standard error of the slope; ddof = 1; n as stated"},"mean_depth":11.35,"n_intervals":20,"primary_non_price_changing":{"alpha":0.0,"alpha_standard_error":0.0,"beta":0.0,"ddof":2,"n":20,"r_squared":null,"specification":"with intercept (primary)","standard_error":0.0,"uncertainty":"standard errors of the slope and intercept; ddof = 2; n as stated"},"secondary_non_price_changing_no_intercept":{"beta":0.0,"ddof":1,"n":20,"r_squared":null,"specification":"no intercept (secondary, proportionality diagnostic)","standard_error":0.0,"uncertainty":"standard error of the slope; ddof = 1; n as stated"},"window_index":1},{"diagnostic_all":{"alpha":-0.009639777,"alpha_standard_error":0.043559442,"beta":0.021816337,"ddof":2,"n":20,"r_squared":0.10423361,"specification":"with intercept (primary)","standard_error":0.015074367,"uncertainty":"standard errors of the slope and intercept; ddof = 2; n as stated"},"diagnostic_all_no_intercept":{"beta":0.023952096,"ddof":1,"n":20,"r_squared":0.191616766,"specification":"no intercept (secondary, proportionality diagnostic)","standard_error":0.011286483,"uncertainty":"standard error of the slope; ddof = 1; n as stated"},"mean_depth":12.92,"n_intervals":20,"primary_non_price_changing":{"alpha":-0.04300424,"alpha_standard_error":0.045471522,"beta":0.004239855,"ddof":2,"n":20,"r_squared":0.003297665,"specification":"with intercept (primary)","standard_error":0.017373775,"uncertainty":"standard errors of the slope and intercept; ddof = 2; n as stated"},"secondary_non_price_changing_no_intercept":{"beta":0.01459854,"ddof":1,"n":20,"r_squared":0.058394161,"specification":"no intercept (secondary, proportionality diagnostic)","standard_error":0.013448768,"uncertainty":"standard error of the slope; ddof = 1; n as stated"},"window_index":2},{"diagnostic_all":{"alpha":0.0,"alpha_standard_error":0.0,"beta":0.0,"ddof":2,"n":20,"r_squared":null,"specification":"with intercept (primary)","standard_error":0.0,"uncertainty":"standard errors of the slope and intercept; ddof = 2; n as stated"},"diagnostic_all_no_intercept":{"beta":0.0,"ddof":1,"n":20,"r_squared":null,"specification":"no intercept (secondary, proportionality diagnostic)","standard_error":0.0,"uncertainty":"standard error of the slope; ddof = 1; n as stated"},"mean_depth":18.085,"n_intervals":20,"primary_non_price_changing":{"alpha":0.0,"alpha_standard_error":0.0,"beta":0.0,"ddof":2,"n":20,"r_squared":null,"specification":"with intercept (primary)","standard_error":0.0,"uncertainty":"standard errors of the slope and intercept; ddof = 2; n as stated"},"secondary_non_price_changing_no_intercept":{"beta":0.0,"ddof":1,"n":20,"r_squared":null,"specification":"no intercept (secondary, proportionality diagnostic)","standard_error":0.0,"uncertainty":"standard error of the slope; ddof = 1; n as stated"},"window_index":3}],"shock_response":{"baseline_spread":{"max":3.0,"mean":1.165289256,"min":1.0,"n":121,"sd":0.4889974,"standard_error":0.044454309,"uncertainty":"sd is the sample SD with ddof = 1; standard_error is sd / sqrt(n)"},"deviation_profile":[{"events_since_shock":0,"spread":1,"spread_deviation":-0.165289256,"t":20},{"events_since_shock":1,"spread":1,"spread_deviation":-0.165289256,"t":20},{"events_since_shock":2,"spread":1,"spread_deviation":-0.165289256,"t":20},{"events_since_shock":3,"spread":1,"spread_deviation":-0.165289256,"t":20},{"events_since_shock":4,"spread":1,"spread_deviation":-0.165289256,"t":20},{"events_since_shock":5,"spread":1,"spread_deviation":-0.165289256,"t":20},{"events_since_shock":6,"spread":1,"spread_deviation":-0.165289256,"t":20},{"events_since_shock":7,"spread":1,"spread_deviation":-0.165289256,"t":20},{"events_since_shock":8,"spread":1,"spread_deviation":-0.165289256,"t":20},{"events_since_shock":9,"spread":1,"spread_deviation":-0.165289256,"t":21},{"events_since_shock":10,"spread":1,"spread_deviation":-0.165289256,"t":21},{"events_since_shock":11,"spread":1,"spread_deviation":-0.165289256,"t":21}],"half_life":null,"half_life_note":"Same reason: the fit needs a declared baseline band to define a deviation to halve.","identified_by":"actor_role == 'exogenous_harness' (gap G2)","recovery_time":null,"recovery_time_note":"NOT COMPUTED HERE BY DESIGN. Recovery time is the first return into a baseline band of +/- epsilon, and epsilon is a threshold. Thresholds and acceptance bands are Week 3 preregistration material; putting one here would preregister it by accident.","shock_event_id":137,"shock_t":20},"spread_and_depth_summary":{"ask_size":{"max":24.0,"mean":11.531055901,"min":1.0,"n":322,"sd":7.842330508,"standard_error":0.437035993,"uncertainty":"sd is the sample SD with ddof = 1; standard_error is sd / sqrt(n)"},"bid_size":{"max":23.0,"mean":11.948328267,"min":2.0,"n":329,"sd":5.766842137,"standard_error":0.317936299,"uncertainty":"sd is the sample SD with ddof = 1; standard_error is sd / sqrt(n)"},"spread":{"max":3.0,"mean":1.077639752,"min":1.0,"n":322,"sd":0.3304816,"standard_error":0.01841702,"uncertainty":"sd is the sample SD with ddof = 1; standard_error is sd / sqrt(n)"}}},"parameters":{"depth":{"definition":"mean over the window of (bid_size + ask_size) / 2 at Level-I","level":1},"interval":{"kind":"fixed_event_count","note":"an interval is a fixed number of consecutive events; 'fixed_step_count' is the other permitted kind and means a fixed number of engine steps","size":4},"sampling":{"depth_series":"every event carrying Level-I","note":"sampling is event-driven, not clock-driven; a clock-driven rule would need an interpolation rule that this contract does not define","spread_series":"every event carrying Level-I"},"shock":{"injection_time":20,"profile_events":12,"protocol":"market_order","side":"buy","size":5,"time_unit":"step"},"window":{"intervals":20,"note":"a window is a fixed number of consecutive intervals; one OLS fit is produced per window"}},"schema_version":"1.0.0","source_log":{"engine":{"engine_id":"min-lob-a","engine_version":"2.0.0"},"log_id":"min-lob-a-20260821","n_events":329,"time_unit":"step"}}
